{"$id":"https://cope.local/schemas/exp1_trace_contract_v1/RuntimeTraceBundleV1.schema.json","$schema":"https://json-schema.org/draft/2020-12/schema","additionalProperties":false,"properties":{"canonical_serialization_version":{"const":"cope-canonical-json/v1"},"episode_id":{"minLength":1,"pattern":"\\S","type":"string"},"execution_context_snapshots":{"items":{"type":"object"},"type":"array"},"ledger_snapshots":{"items":{"type":"object"},"type":"array"},"occurrence_allocator_version":{"const":"cope-exp1-occurrence-allocator/v1"},"patches":{"items":{"type":"object"},"type":"array"},"planning_problems":{"items":{"type":"object"},"type":"array"},"progress_certificates":{"items":{"type":"object"},"type":"array"},"public_events":{"items":{"type":"object"},"type":"array"},"schema_version":{"const":"cope-exp1-trace-contract/v1"},"sealed_outcome_ref":{"anyOf":[{"pattern":"^[0-9a-f]{64}$","type":"string"},{"type":"null"}]},"trace_id":{"minLength":1,"pattern":"\\S","type":"string"}},"required":["schema_version","canonical_serialization_version","occurrence_allocator_version","trace_id","episode_id","public_events","ledger_snapshots","execution_context_snapshots","patches","planning_problems","progress_certificates","sealed_outcome_ref"],"title":"RuntimeTraceBundleV1","type":"object"}
