{"canonical_serialization_version":"cope-canonical-json/v1","episode_id":"NOT_FORMAL_EVIDENCE__episode-001","execution_context_snapshots":[{"beliefs":[{"confidence":0.75,"evidence_ids":["evidence-001"],"key":"cup_visible","timestamp":11,"value":true}],"captured_at_step":11,"continuation":{"active_skill":"place"},"progress":[]}],"ledger_snapshots":[{"history_records":[],"relations":[],"revision":3,"slots":[{"arguments":["cup","tray"],"family_key":"place-cup","lifecycle":"active","occurrence_id":"place-cup@1","predicate":"on"}]}],"occurrence_allocator_version":"cope-exp1-occurrence-allocator/v1","patches":[{"accepted":true,"base_revision":2,"checks":[],"confidence":0.9,"episode_id":"NOT_FORMAL_EVIDENCE__episode-001","event_index":1,"operations":[],"patch_id":"patch-001","rejection_reasons":[]}],"planning_problems":[{"active_goal_occurrence_ids":["place-cup@1"],"continuation_assumptions":{},"forbidden_regressions":[],"grounding_bindings":[],"hard_constraints":[],"initial_facts":[],"problem_id":"problem-001","progress_certificates":[],"remaining_goals":[],"restore_eligibility":[],"soft_preferences":[],"source_method":"cope","source_revision":3}],"progress_certificates":[],"public_events":[{"affected_entity_hypotheses":["cup"],"confidence":0.8,"event_id":"event-001","event_index":1,"evidence_ids":["evidence-001"],"hypothesis":"The cup may have moved","observation_refs":["frame-011"],"provenance":"synthetic_fixture","timestamp":11,"user_message":null}],"schema_version":"cope-exp1-trace-contract/v1","sealed_outcome_ref":"aaaaaaaaaaaaaaaaaaaaaaaaaaaaaaaaaaaaaaaaaaaaaaaaaaaaaaaaaaaaaaaa","trace_id":"NOT_FORMAL_EVIDENCE__trace-001"}
